NCTID:NCT01412541||dmc_oversight:Yes||primary_outcome_count:2||primary_outcome_list:Primary Safety - Percentage of Subjects With Composite of Freedom From All-cause Peri-operative (≤30 Day) Death and Freedom From the Following: Index Limb Amputation, Index Limb Re-intervention, and Index-limb-related Death at 12 Months.|12 months|,Primary Efficacy - Percentage of Subjects With Primary Patency of the Target Lesion at One Year.|12 months|,||||secondary_outcome_count:50||secondary_outcome_list:Secondary Efficacy #1 - Number of Devices With Device Success.|During the procedure|,Secondary Efficacy #1A - Number of Subjects With Technical Success.|During the procedure|,Secondary Efficacy #1B - Number of Subjects With Procedural Success.|During the procedure|,Secondary Efficacy #2 - Percentage of Subjects With Duplex Ultrasound Clinical Primary Patency [Freedom From Clinically Driven Target Lesion Revascularization (TLR) and Binary Restenosis] at 6 Months.|6 Months|,Secondary Efficacy #2 - Percentage of Subjects With Duplex Ultrasound Clinical Primary Patency [Freedom From Clinically Driven Target Lesion Revascularization (TLR) and Binary Restenosis] at 12 Months.|12 Months|,Secondary Efficacy #2A - Percentage of Subjects With Secondary Patency (Absence of Target Lesion Restenosis by Core Lab Adjudication) at 6 Months.|6 Months|,Secondary Efficacy #2A - Percentage of Subjects With Secondary Patency Rate at 12 Months (Defined by Core Lab Adjudication).|12 Months|,Secondary Efficacy #3 - Percentage of Subjects With Alternative Primary Patency Based on Alternative Definitions of Duplex Ultrasound Peak Systolic Velocity Ratio (DUS PSVR) <2.0 Through 6 Months.|6 Months|,Secondary Efficacy #3 - Percentage of Subjects With Alternative Primary Patency Based on Alternative Definitions of Duplex Ultrasound (DUS) Peak Systolic Velocity Ratio (PSVR) <2.0 Through 12 Months.|12 Months|,Secondary Efficacy #3A - Percentage of Subjects With Alternative Primary Patency Based on Alternative Definitions of Duplex Ultrasound (DUS) Peak Systolic Velocity Ratio (PSVR) <3.0 Through 6 Months.|6 Months|,Secondary Efficacy #3A - Percentage of Subjects With Alternative Primary Patency Based on Alternative Definitions of Duplex Ultrasound (DUS) Peak Systolic Velocity Ration (PSVR) <3.0 Through 12 Months.|12 Months|,Secondary Efficacy #4 - Percentage of Subjects With Alternative Primary Patency Based on Alternative Definitions of Suplex Ultrasound (DUS) Peak Systolic Velocity Ration (PSVR) <2.5 Through 6 Months.|6 Months|,Secondary Efficacy #4 - Percentage of Subjects With Alternative Primary Patency Based on Alternative Definitions of Duplex Ultrasound (DUS) Peak Systolic Velocity Ratio (PSVR) <2.5 Through 12 Months.|12 Months|,Secondary Efficacy #5 - Percentage of Subject With Freedom From Target Lesion Revascularization (TLR) Clinically-driven at 6 Months.|6 Months|,Secondary Efficacy #5 - Percentage of Subjects With Freedom From Target Lesion Revascularization (TLR) Clinically-driven at 12 Months.|12 Months|,Secondary Efficacy #5A - Percentage of Subjects With Freedom From Target Lesion Revascularization (TLR) Total (Clinical and DUS/Angiography - Driven) at 6 Months.|6 Months|,Secondary Efficacy #5A - Percentage of Subjects With Freedom From Target Lesion Revascularization (TLR) Total (Clinical and DUS/Angiography - Driven) at 12 Months.|12 Month|,Secondary Efficacy #6 - Percentage of Subjects With Change of Rutherford Classification From Baseline to 6 Months (%Improved).|Baseline and 6 Months|,Secondary Efficacy #6 - Percentage of Subjects With Change of Rutherford Classification From Baseline to 12 Months.|Baseline and 12 Months|,Secondary Efficacy #7 - Mean Difference Between the Baseline and 6 Months of Resting Ankle Brachial Index (ABI).|Baseline and 6 Months|,Secondary Efficacy #7 - Mean Difference Between the Baseline and 12 Months of Resting Ankle Brachial Index (ABI).|Baseline and 12 Months|,Secondary Efficacy #8 - Mean Differences Between the Total Walking Impairment Questionnaire Score From Baseline to 6 Months.|Baseline and 6 months|,Secondary Efficacy #8 - Mean Differences Between the Total Walking Impairment Questionnaire Score From Baseline to 12 Months.|Baseline and 12 Months|,Secondary Efficacy #9 - Mean of Subjects With Change in Six Minute Walk Test Distance From Baseline to 6 Months.|Baseline and 6 Months|,Secondary Efficacy #9 - Mean of Subjects With Change in Six Minute Walk Test Distance From Baseline Through 12 Months.|Baseline and 12 Months|,Secondary Efficacy #10 - Mean Change of the EuorQol (EQ-5D) Index From Baseline to 6 Months.|Baseline and 6 Months|,Secondary Efficacy #10 - Mean Change of the EuorQol (EQ-5D) Index From Baseline to 12 Months.|Baseline and 12 Months|,Secondary Efficacy #10A - Mean Change in Quality of Life Physical and Mental Component of SF-36 v2 From Baseline to 6 Months.|Baseline and 6 Months|,Secondary Efficacy #10A - Mean Change in Quality of Life Physical Component and Mental Component of SF-36 v2 From Baseline to 12 Months.|Baseline and 12 Months|,Secondary Safety #1 - Percentage of Subjects With Freedom From All-cause Death, Index Limb Amputation Above the Ankle and Target Vessel Revascularization (TVR) (VIVA Safety Endpoint).|30 days|,Secondary Safety #2 - Percentage of Subjects With Composite of Freedom From All-cause Perioperative (≤30 Day) Death and Freedom From the Following at 1 Month: Index Limb Amputation, Index Limb Re-intervention, and Index-limb-related Death at 1 Month.|1 Month|,Secondary Safety #2 - Percentage of Subjects With Composite of Freedom From All-cause Perioperative (≤30 Day) Death and Freedom From the Following at 6 Months: Index Limb Amputation, Index Limb Re-intervention, and Index-limb-related Death.|6 Months|,Secondary Safety #3 - Percentage of Subjects With All-cause Death at 1 Month.|1 month|,Secondary Safety #3 - Percentage of Subjects With All-cause Death at 6 Months.|6 Months|,Secondary Safety #3 - Percentage of Subjects With All-cause Death at 12 Months.|12 Months|,Secondary Safety #4 - Percentage of Subjects With Amputation (Above the Ankle)-Free Survival (AFS) 1 Month.|1 Month|,Secondary Safety #4 - Percentage of Subjects With Amputation (Above the Ankle)-Free Survival (AFS) 6 Months.|6 Months|,Secondary Safety #4 - Percentage of Subjects With Amputation (Above the Ankle)-Free Survival (AFS) 12 Months.|12 Months|,Secondary Safety #5 - Percentage of Subjects With Target Vessel Revascularization (TVR) at 1 Month.|1 Month|,Secondary Safety #5 - Percentage of Subjects With Target Vessel Revascularization (TVR) at 6 Months.|6 Months|,Secondary Safety #5 - Percentage of Subjects With Target Vessel Revascularization (TVR) at 12 Months.|12 Months|,Secondary Safety #6 - Percentage of Subjects With Reintervention for Treatment of Thrombosis of the Target Vessel or Embolization to Its Distal Vasculature at 1 Month.|1 Month|,Secondary Safety #6 - Percentage of Subjects With Reintervention for Treatment of Thrombosis of the Target Vessel or Embolization to Its Distal Vasculature at 6 Months.|6 Months|,Secondary Safety #6 - Percentage of Subjects With Reintervention for Treatment of Thrombosis of the Target Vessel or Embolization to Its Distal Vasculature at 12 Months.|12 Months|,Secondary Safety #7 - Percentage of Subjects With Major Vascular Complications at 1 Month.|1 Month|,Secondary Safety #7 - Percentage of Subjects With Major Vascular Complications at 6 Months.|6 Months|,Secondary Safety #7 - Percentage of Subjects With Major Vascular Complications at 12 Months.|12 Months|,Secondary Safety #8 - Percentage of Subjects With Readmission for Cardiovascular Events at 1 Month.|1 Month|,Secondary Safety #8 - Percentage of Subjects With Readmission for Cardiovascular Events at 6 Months.|6 Months|,Secondary Safety #8 - Percentage of Subjects With Readmission for Cardiovascular Events at 12 Months.|12 Months|,||||arm_group_count:2||arm_group_list:Moxy Drug Coated Balloon|Paclitaxel coated balloon catheter,Standard Uncoated Angioplasty Balloon|PTA Catheter,||||inclusion_exclusion: Clinical Inclusion Criteria: 1. Male or non-pregnant female ≥18 years of age; 2. Rutherford Clinical Category 2-4; 3. Patient is willing to provide informed consent, is geographically stable and comply with the required follow up visits, testing schedule and medication regimen; Angiographic Lesion Inclusion Criteria: 4. Length ≤15 cm; 5. Up to two focal lesions or segments within the designated 15 cm length of vessel may be treated (e.g. two discrete segments, separated by several cm, but both falling within a composite length of <15 cm); 6. ≥70% stenosis by visual estimate; 7. Lesion location starts ≥1 cm below the common femoral bifurcation and terminates distally ≤2 cm below the tibial plateau AND ≥1 cm above the origin of the TP trunk; 8. de novo lesion(s) or non-stented restenotic lesion(s) >90 days from prior angioplasty procedure; 9. Lesion is located at least 3 cm from any stent, if target vessel was previously stented; 10. Target vessel diameter between ≥4 and ≤6 mm and able to be treated with available device size matrix; 11. Successful, uncomplicated (without use of a crossing device) antegrade wire crossing of lesion; 12. A patent inflow artery free from significant lesion (≥50% stenosis) as confirmed by angiography (treatment of target lesion acceptable after successful treatment of inflow artery lesions); NOTE: Successful inflow artery treatment is defined as attainment of residual diameter stenosis ≤30% without death or major vascular complication. 13. At least one patent native outflow artery to the ankle, free from significant (≥50%) stenosis as confirmed by angiography that has not previously been revascularized (treatment of outflow disease is NOT permitted during the index procedure); 14. Contralateral limb lesion(s) cannot be treated within 2 weeks before and/or planned 30 days after the protocol treatment in order to avoid confounding complications; 15. No other prior vascular interventions within 2 weeks before and/or planned 30 days after the protocol treatment. Exclusion Criteria: Patients will be excluded if ANY of the following conditions apply: 1. Pregnant or planning on becoming pregnant or men intending to father children; 2. Life expectancy of <5 years; 3. Patient is currently participating in an investigational drug or other device study or previously enrolled in this study; NOTE: Enrollment in another clinical trial during the follow up period is not allowed. 4. History of hemorrhagic stroke within 3 months; 5. Previous or planned surgical or interventional procedure within 2 weeks before or within 30 days after the index procedure; 6. History of myocardial infarction (MI), thrombolysis or angina within 2 weeks of enrollment; 7. Rutherford Class 0, 1, 5 or 6; 8. Renal failure or chronic kidney disease with modification in diet in renal disease glomerular filtration rate (MDRD GFR) ≤30 ml/min per 1.73 m2 (or serum creatinine ≥2.5 mg/L within 30 days of index procedure or treated with dialysis); 9. Prior vascular surgery of the index limb, with the exception of remote common femoral patch angioplasty separated by at least 2 cm from the target lesion; 10. Inability to take required study medications or allergy to contrast that cannot be adequately managed with pre- and post-procedure medication; 11. Anticipated use of IIb/IIIa inhibitor prior to randomization; 12. Ipsilateral retrograde access; 13. Composite lesion length is >15 cm or there is no normal proximal arterial segment in which duplex flow velocity can be measured; 14. Significant inflow disease. Successful treatment of inflow disease allowed prior to target lesion treatment; 15. Known inadequate distal outflow (>50 % stenosis of distal popliteal and/or all three tibial vessels), or planned future treatment of vascular disease distal to the target lesion; 16. Sudden symptom onset, acute vessel occlusion, or acute or sub-acute thrombus in target vessel; 17. Severe calcification that renders the lesion un-dilatable; 18. Use of adjunctive treatment modalities (i.e. laser, atherectomy, cryoplasty, scoring/cutting balloon, etc.). ||mesh_term:Arterial Occlusive Diseases,Constriction, Pathologic,||||
NCTID:NCT00987324||dmc_oversight:No||primary_outcome_count:1||primary_outcome_list:Percent in-segment diameter stenosis at follow-up angiography|6-8 months|,||||secondary_outcome_count:4||secondary_outcome_list:In-segment minimal luminal diameter|6-8 months|,In-segment binary angiographic restenosis|6-8 months|,Combined incidence of death or myocardial infarction|1 and 2 years|,Incidence of thrombosis|1 and 2 years|,||||arm_group_count:3||arm_group_list:Paclitaxel-eluting stent|Paclitaxel-eluting stent (Taxus),Plain Balloon|plain balloon angioplasty,Paclitaxel-eluting balloon|SeQuent Please,||||inclusion_exclusion: Inclusion Criteria: 1. Patients with ischemic symptoms or evidence of myocardial ischemia in the presence of ≥ 50% restenosis after prior implantation of LES in native coronary vessels. 2. Written, informed consent by the patient or her/his legally-authorized representative for participation in the study. 3. In women with childbearing potential a negative pregnancy test is mandatory. Exclusion Criteria: 1. Age < 18 years. 2. Cardiogenic shock. 3. Acute ST-elevation myocardial infarction within 48 hours from symptom onset. 4. Target lesion located in the left main trunk or bypass graft. 5. Target lesion located in small vessel (vessel size < 2.0 mm). 6. Malignancies or other comorbid conditions (for example severe liver, renal and pancreatic disease) with life expectancy less than 12 months or that may result in protocol non-compliance. 7. Severe renal insufficiency (glomerular filtration rate ≤ 30 ml/min). 8. Contraindications to antiplatelet therapy, paclitaxel, stainless steel, cobalt, chrome. 9. Pregnancy (present, suspected or planned) or positive pregnancy test. 10. Previous enrollment in this trial. 11. Patient's inability to fully comply with the study protocol. ||mesh_term:Heart Diseases,Ischemia,Paclitaxel,Albumin-Bound Paclitaxel,||||
NCTID:NCT01495533||dmc_oversight:Yes||primary_outcome_count:1||primary_outcome_list:late lumen loss in-segment|6 months|,||||secondary_outcome_count:2||secondary_outcome_list:Procedural Success|participants will be followed for the duration of hospital stay, an expected average of 2 days|,Major adverse cardiovascular events|6 months|,||||arm_group_count:2||arm_group_list:uncoated AngioSculpt(R)|Predilatation of coronary BMS-ISR with POBA followed by a AngioSculpt(R) scoring balloon (no drug coating),drug coated AngioSculpt(R)|Predilatation of coronary BMS-ISR with POBA followed by a drug coated AngioSculpt(R) scoring balloon (paclitaxel 3.0 µg/mm²),||||inclusion_exclusion: Inclusion Criteria: - >18 years of age - clinical evidence of stable or unstable angina or a positive functional study - patients with ≤ 2 primary in-stent restenosis (ISR) lesions (≥ 70% diameter stenosis) within previously placed bare metal stents (BMS) Exclusion Criteria: - acute myocardial infarction within the past 72 hours - chronic renal insufficiency with serum creatinine levels >2.0 mg per deciliter% - known hypersensitivity or contraindications to aspirin, heparin, clopidogrel, ticlopidine or paclitaxel, and sensitivity to contrast media not amenable to premedication - concomitant medical illness associated with a life-expectancy of less than two years - stented segment length ≥30 mm, vessel diameter <2.5 mm, diameter stenosis <70% ||mesh_term:Paclitaxel,Albumin-Bound Paclitaxel,||||
NCTID:NCT01239953||dmc_oversight:Yes||primary_outcome_count:1||primary_outcome_list:Minimal lumen diameter|Late angiographic follow-up (6-9 months)|,||||secondary_outcome_count:1||secondary_outcome_list:Combined clinical and angiographic end-points|6-9 months, 1 year and 3 years|,||||arm_group_count:2||arm_group_list:Paclitaxel-eluting balloon|Paclitaxel-eluting balloon (SeQuent Please, B. Braun),Everolimus-eluting stent|Everolimus-eluting stent (Xience Prime, Abbott Vascular),||||inclusion_exclusion: Inclusion Criteria: PATIENT: - Age between 20 and 85 years - Signed informed consent - Acceptance of late angiographic control (6-9 months) - Angina and / or objective evidence of ischemia LESION: - In-Stent restenosis (> 50% visual) any bare metal stent - Knowledge of prior stent location Exclusion Criteria: PATIENT: - Inclusion in another clinical research protocol - Women of childbearing age - Severe associated systemic disease (including renal or liver failure) - Severe depression of left ventricular ejection fraction (LVEF <25%) - Disease that affects life expectancy - Recent myocardial infarction ( <7 days) - Time of implantation of the previous BMS <1 month - Severe difficulties expected for late angiographic study LESION: - Angiographic failure during implementation of initial stent(residual stenosis> 50%) - Image of large thrombus in-stent (> vessel diameter) - Tortuosity or Ca + + with very severe difficulties during prior stent deployment - Vessel diameter <2 mm (visual estimate) - Restenosis only "outside" the stent (The edge of the stent is not affected) - Completely occlusive restenosis (100%, TIMI 0) - Very diffuse restenosis (> 30 mm length) ||mesh_term:Sirolimus,Paclitaxel,Albumin-Bound Paclitaxel,Everolimus,||||
NCTID:NCT01239940||dmc_oversight:Yes||primary_outcome_count:1||primary_outcome_list:Minimal lumen diameter|Late angiographic follow-up (6-9 months)|,||||secondary_outcome_count:1||secondary_outcome_list:Combined clinical and angiographic end-points|6-9 months, 1 year and 3 years|,||||arm_group_count:2||arm_group_list:Paclitaxel-eluting balloon|Paclitaxel-eluting balloon (SeQuent Please, B. Braun),Everolimus-eluting stent|Everolimus-eluting stent (Xience Prime, Abbott Vascular),||||inclusion_exclusion: Inclusion Criteria: PATIENT: - Age between 20 and 85 years - Signed informed consent - Acceptance of late angiographic control (6-9 months) - Angina and / or objective evidence of ischemia LESION: - In-Stent restenosis (> 50% visual) any drug-eluting stent - Knowledge of prior stent location Exclusion Criteria: PATIENT: - Inclusion in another clinical research protocol - Women of childbearing age - Severe associated systemic disease (including renal or liver failure) - Severe depression of left ventricular ejection fraction (LVEF <25%) - Disease that affects life expectancy - Recent myocardial infarction ( <7 days) - Time of implantation of the previous DES <1 month - Severe difficulties expected for late angiographic study LESION: - Angiographic failure during implementation of initial stent(residual stenosis> 50%) - Image of large thrombus in-stent (> vessel diameter) - Tortuosity or Ca + + with very severe difficulties during prior stent deployment - Vessel diameter <2 mm (visual estimate) - Restenosis only "outside" the stent (The edge of the stent is not affected) - Completely occlusive restenosis (100%, TIMI 0) - Very diffuse restenosis (> 30 mm length) ||mesh_term:Sirolimus,Paclitaxel,Albumin-Bound Paclitaxel,Everolimus,||||
NCTID:NCT01255956||dmc_oversight:No||primary_outcome_count:3||primary_outcome_list:Incidence of repeated restenosis angiographically evidenced|at 9 months|,Neointimal volume assessed by intravascular ultrasound (IVUS)|at 9 months|,Late lumen loss and neointimal volume assessed by optical coherence tomography (OCT)|at 9 months|,||||secondary_outcome_count:6||secondary_outcome_list:Incidence of repeated target lesion revascularization (TLR)|at 9 months|,Incidence of repeated target vessel revascularization (TVR)|at 9 months|,Incidence of death|at 9 months|,Incidence of myocardial infarction|at 9 months|,Incidence of brain stroke|at 9 months|,Incidence of in-stent thrombosis|at 9 months|,||||arm_group_count:2||arm_group_list:Rapamycin eluting stent|Patients treated with rapamycin eluting stent (n=100),Paclitaxel eluting balloon catheter|Patients treated with paclitaxel eluting balloon catheter (n=100),||||inclusion_exclusion: Inclusion Criteria: - at least 18 years of age - symptomatic restenosis in bare metal stent implanted in native coronary artery - angina pectoris - ischemia evidenced by non-invasive diagnostic tests - angiographically evidenced in-stent restenosis > 50% assessed by quantitative coronary angiography (QCA) - vessel diameter > 2,5 mm Clinical exclusion criteria: - myocardial infarction within less than past 72 hours - heart failure with left ventricular ejection fraction (LVEF) < 30% - chronic renal failure with significant impairment of glomerular filtration (creatinine > 2 mg/dl) - hypersensitivity or contraindication to acetylsalicylic acid, clopidogrel, heparin, abciximab, rapamycin, paclitaxel - hypersensitivity to contrast - other diseases that may cause significant deterioration in long-term prognosis - acute or chronic inflammatory diseases - patients who are unwilling to consent for participation in the study Angiographic exclusion criteria: - significant stenosis in left main coronary artery (LM) - multivessel disease qualifying for coronary artery bypass grafting (CABG) - anatomical localization and morphology that preclude optimal percutaneous intervention intervention's (PCI) result or intravascular ultrasound (IVUS) or optical coherence tomography performance - vessel diameter < 2,5 mm - restenotic lesion length > 30 mm ||mesh_term:Sirolimus,Paclitaxel,Albumin-Bound Paclitaxel,Everolimus,||||
NCTID:NCT00485030||dmc_oversight:Yes||primary_outcome_count:1||primary_outcome_list:Binary in-segment angiographic restenosis|at 9 months angiographic follow-up|,||||secondary_outcome_count:4||secondary_outcome_list:The composite of death, myocardial infarction, and target-vessel revascularization|in-hospital, 1 month, and 9 months after index procedure|,stent thrombosis|in-hospital, 1 month, and 9 months after index procedure|,Late luminal loss|at 8 month angiographic follow-up|,Procedural success defined as achievement of a final diameter stenosis of <30% by QCA using any percutaneous method, without the occurrence of death, Q wave MI, or repeat revascularization of the target lesion|during the hospital stay|,||||arm_group_count:2||arm_group_list:Cypher|sirolimus-eluting stent,Xience-V|everolimus-eluting stent,||||inclusion_exclusion: Inclusion Criteria: 1. The patient must be at least 18 years of age. 2. Restenosis after drug-eluting stents (>50% by visual estimate) 3. Lesion length ≥ 10 mm (diffuse type ISR) 4. Patients with stable (CCS class 1 to 4) or acute coronary syndromes (unstable angina pectoris Braunwald class IB, IC, IIB, IIC, IIIB, IIIC or NSTEMI) or patients with atypical chest pain or without symptoms but having documented myocardial ischemia, amenable to stent-assisted percutaneous coronary intervention 5. The patient or guardian agrees to the study protocol and the schedule of clinical and angiographic follow-up, and provides informed, written consent, as approved by the appropriate Institutional Review Board/Ethical Committee of the respective clinical site. Exclusion Criteria: 1. The patient has a known hypersensitivity or contraindication to any of the following medications: - Heparin - Aspirin - Both Clopidogrel and TIclopidine - Sirolimus eluting stent - Stainless steel and/or - Contrast media (patients with documented sensitivity to contrast which can be effectively pre-medicated with steroids and diphenhydramine [e.g. rash] may be enrolled. Patients with true anaphylaxis to prior contrast media, however, should not be enrolled). 2. Systemic (intravenous) Sirolimus use within 12 months. 3. Female of childbearing potential, unless a recent pregnancy test is negative, who possibly plan to become pregnant any time after enrollment into this study. 4. History of bleeding diathesis or known coagulopathy (including heparin-induced thrombocytopenia), or will refuse blood transfusions. 5. Gastrointestinal or genitourinary bleeding within the prior 3 months, or major surgery within 2 months. 6. Current known current platelet count <100,000 cells/mm3 or Hgb <10 g/dL. 7. Non-cardiac co-morbid conditions are present with life expectancy <1 year or that may result in protocol non-compliance (per site investigator's medical judgment). 8. Patients who are actively participating in another drug or device investigational study, which have not completed the primary endpoint follow-up period. 9. Patients with EF<30%. 10. Acute MI patients within symptom onset < 12 hours needing primary angioplasty 11. Creatinine level 3.0mg/dL or dependence on dialysis. 12. Severe hepatic dysfunction (AST and ALT 3 times upper normal reference values). 13. Patients with left main stem stenosis and left main in-stent restenosis created by DES(>50% by visual estimate) ||mesh_term:Sirolimus,Everolimus,||||
