NCTID:NCT03884257||dmc_oversight:Yes||primary_outcome_count:2||primary_outcome_list:freedom from clinically-driven target lesion revascularization (CD-TLR) at 12 months post-procedure|12 months post-procedure|,Safety composite of death, major amputation, and target vessel revascularization (CD-TVR)|12 months post-procedure|,||||secondary_outcome_count:15||secondary_outcome_list:acute device success|Index procedure|,acute procedural success|index procedure|,freedom from all causes of death, freedom from major target limb amputation and freedom from CD-TVR through 30 days|1 month post-procedure|,Sustained clinical improvement|6 and 12 months post-procedure|,freedom from major adverse events|6 and 12 months post-procedure|,primary patency rate|6 and 12 months post-procedure|,freedom from target lesion revascularisation|6 and 12 months post-procedure|,freedom from target vessel revascularisation|6 and 12 months post-procedure|,freedom from binary restenosis|6 and 12 months post-procedure|,freedom from major target limb amputation|6 and 12 months post-procedure|,freedom from thrombosis at target lesion|6 and 12 months post-procedure|,change in walking impairment questionnaire score from baseline to 6 and 12 months|6 and 12 months post-procedure|,change in target limb rutherford class from baseline to 6 and 12 months|6 and 12 months post-procedure|,change in target limb resting ABI or TBI from baseline to 6 and 12 months|6 and 12 months post-procedure|,freedom from all causes of death|6 and 12 months post-procedure|,||||arm_group_count:2||arm_group_list:Passeo-18 Lux treatment group|These patients will be treated with the Passeo-18 Lux (Biotronik).,IN.PACT Admiral treatment group|These patients will be treated with the IN.PACT Admiral (Medtronic).,||||inclusion_exclusion: Inclusion Criteria: - Subject is ≥18 years - Subject has Rutherford classification 2, 3 or 4 - Subject has provided written informed consent and is willing to comply with study follow- up requirements - De novo stenotic or occlusive lesion(s) or non-stented restenotic or occlusive lesion(s) occurring >90 days after prior plain old balloon (POBA) angioplasty or >180 days after prior DCB treatment - Target lesion is located between the ostium of the SFA and the end of the P1 segment of the popliteal artery - Target vessel diameter ≥4mm and ≤7mm - Target lesion must be stenotic lesion ≤180mm in length (one long lesion or tandem lesions) by investigator's visual estimate or a total occlusion ≤120mm in length by investigator's visual estimate. Note: tandem lesions must have a total length of ≤180mm by visual estimate and be separated by ≤30mm - Target lesion must have angiographic evidence of ≥70% stenosis by investigator's visual estimation - Successful, uncomplicated crossing of the target lesion occurs when the tip of the guide wire is distal to the target lesion without the occurrence of flow-limiting dissection or perforation and is judged by visual inspection to be within the true lumen. Subintimal dissection techniques may be used if re-entry occurs above the knee (ATK) and without the use of re-entry devices - Target lesion is located at least 30mm from any stent, if target vessel was previously stented - After pre-dilatation, the target lesion is ≤50% residual stenosis, absence of a flow-limiting dissection and treatable with available device matrix - A patent inflow artery free from significant stenosis (≥50% stenosis) as confirmed by angiography - At least one patent native outflow artery to the ankle or foot, free from significant stenosis (≥50% stenosis) as confirmed by angiography Exclusion Criteria: - Acute limb ischemia - Patient underwent an intervention involving the target vessel within the previous 90 days - Patient underwent any lower extremity percutaneous treatment in the ipsilateral limb using a paclitaxel-eluting stent or DCB within the previous 90 days - Patient underwent a percutaneous transluminal angioplasty (PTA) of the target lesion using a DCB within the previous 180 days - Women who are pregnant, breast-feeding or intend to become pregnant - Patient has life expectancy of less than 1 year - Patient has a known allergy to contrast medium that cannot be adequately pre-medicated - Patient is allergic to all antiplatelet treatments - Patient is receiving immunosuppressant therapy - Patient has platelet count <100.000/mm3 or >700.000/mm3 - Patient has history of gastrointestinal haemorrhage requiring a transfusion within 3 months prior to the study procedure - Patient is diagnosed with coagulopathy that precludes treatment with systemic anticoagulation and/or dual antiplatelet therapy (DAPT) - Patient has history of stroke within the past 90 days - Patient has history of myocardial infarction within the past 30 days - Patient is participating in an investigational drug or medical device study that has not completed primary endpoint(s) evaluation or that clinically interferes with the endpoints from this study, or patient is planning to participate in such study prior to the completion of this study - Patient has had any major (e.g. cardiac, peripheral, abdominal) surgical procedure or intervention unrelated to this study within 30 days prior to the index procedure or has planned major surgical procedure or intervention within 30 days of the index procedure - An intervention in the contralateral limb, planned within 30 days post-index procedure - Patient had previous bypass surgery of the target lesion - Patient had previous treatment of the target vessel with thrombolysis or surgery - Patient is unwilling or unable to comply with procedures specified in the protocol or has difficulty or inability to return for follow-up visits as specified by the protocol - Target lesion involves an aneurysm or is adjacent to an aneurysm (within 5mm) - Target lesion requires treatment with alternative therapy such as stenting, laser, atherectomy, cryoplasty, brachytherapy or re-entry devices - Significant target vessel tortuosity or other parameters prohibiting access to the target lesion - Presence of thrombus in the target vessel - Iliac inflow disease requiring treatment, unless the iliac artery disease is successfully treated first during the index procedure. Success is defined as ≤30% residual diameter stenosis without death or major complications - Presence of an aortic, iliac or femoral artificial graft ||mesh_term:Peripheral Arterial Disease,Peripheral Vascular Diseases,||||
NCTID:NCT02129634||dmc_oversight:No||primary_outcome_count:1||primary_outcome_list:Primary patency of the treated (index) site at 6 months|6 months|,||||secondary_outcome_count:10||secondary_outcome_list:Limb-salvage rate|at 3, 6 and 12 months|,Primary patency of the treated (index) site|at 3 months|,Clinical categorisation of the treated ischemic leg|at 3, 6 and 12 months|,Minor amputation|at 3, 6 and 12 months|,Infrapopliteal surgical bypass of the trial leg|at 3, 6 and 12 months|,Infrapopliteal endovascular re-intervention of the trial leg|at 3, 6 and 12 months|,Primary patency of treated femoropopliteal sites|From the date of randomization until the date of end of primary patency of treated femoropopliteal sites (asscessed up to 12 months)|,Peri-procedural complications|(within 30 days)|,Death|From the date of randomization until the date of death from any cause (asscessed up to 12 months)|,Incremental cost-effectiveness ratio (ICER)|at 3 month, 6 month and 12 month|,||||arm_group_count:2||arm_group_list:CB-PTA arm|After successful crossing of the trial lesion, a conventional angioplasty balloon with a diameter matching the trial vessel is advanced over the guidewire and is inflated at the trial lesion site, according to the normal practice of the operator. Comparisons of pre- and post-angioplasty percentage stenosis will be made in the same angiographic projection(s).,DEB-PTA arm|After successful crossing of the trial lesion, angioplasty with a conventional angioplasty balloon is performed before DEB-PTA. This is because the paclitaxel coating may be scrapped off the balloon if the DEB is used to cross the trial lesion. A conventional angioplasty balloon with a diameter matching the trial vessel is advanced over the guidewire and is inflated at the trial lesion site, according to the normal practice of the operator. A DEB with a diameter matching the trial vessel and lesion length is then advanced over the 0.018 inch guidewire and inflated at the trial lesion site for 60 seconds. If the lesion length is longer than the length of the balloon, a second inflation with another DEB will be required. The maximal total lesion length of the treated lesions will not exceed 20cm. Comparisons of pre- and post-angioplasty percentage stenosis will be made in the same angiographic projection(s).,||||inclusion_exclusion: Inclusion Criteria: - Written informed consent - Age > 21 years - If female patient with child bearing potential, patient may not be pregnant at the study entry and must utilize reliable birth control for the duration of her participation into the study - Patient is willing and able to comply with the specified follow-up evaluation - Critical Limb Ischaemia, Rutherford category 4 (ischaemic rest pain), 5 (minor tissue loss) or 6 (major tissue loss) - Stenosis (>50% luminal loss) or occlusion of infra-genicular arteries (defined as: distal to the infra-popliteal artery), including the tibiofibular trunk, the anterior tibial artery, the posterior tibial artery and the peroneal artery - Infragenicular arterial lesions with length of <20cm - At least one crural (anterior tibial, posterior tibial or peroneal) artery with expected unobstructed runoff to ankle level after treatment - Successful guidewire crossing of the trial lesion Exclusion Criteria: - Acute limb ischaemia - Subacute limb ischaemia which requires thrombolysis as first treatment modality - Previous major amputation of the affected limb (at or above the level of the ankle) - Concurrent iliac or femoropopliteal artery disease not suitable for endovascular or surgical revascularisation - Concurrent iliac or femoropopliteal artery occlusion of >10cm, even if suitable for surgical or endovascular revascularization - Patients without (expected) distal runoff to the index site - Revascularization involving the same site within 30 days prior to the index procedure or planned revascularization of the same limb within 30 days of the index procedure - Previous implanted stent at the index site - Life expectancy of less than 6 months - Factors making clinical follow-up very difficult or impossible - Known allergy to paclitaxel - Known allergy to contrast media - Patients on Warfarin or any other anti-coagulants - Known allergy to anti-platelet drugs (Aspirin/ Clopidogrel) (or) unable to tolerate dual anti-platelet drugs therapy - Active history of gastritis and other bleeding tendencies precluding use of dual anti-platelet therapy - Known heparin induced thrombocytopenia (HIT type 2) - Patient unable or unwilling to tolerate contrast media - eGFR less than 50 ml/min/1.73m2 unless patient is on dialysis. - If the patient has significant heart disease and Left Ventricular Ejection Fraction Percentage (LVEF%) is less than 35 %. - Either PT/PTT of >1.5 times the median of normal that cannot be corrected for the time of the procedure (or ) INR >1.6 that cannot be corrected for the time of the procedure - Thrombocytopenia of platelet count <50,000 /µL (50 X 109/L) which cannot be corrected for the time of the procedure ||mesh_term:Peripheral Arterial Disease,Peripheral Vascular Diseases,Ischemia,Paclitaxel,Albumin-Bound Paclitaxel,||||
NCTID:NCT02772224||dmc_oversight:No||primary_outcome_count:2||primary_outcome_list:Restenosis rate|12 months|,Peak systolic velocity ratio|12 months|,||||secondary_outcome_count:3||secondary_outcome_list:Rutherford scale|Immediately after procedure|,ABI value|Immediately after procedure|,Residual stenosis|Immediately after procedure|,||||arm_group_count:2||arm_group_list:Drug eluting balloon angioplasty|Paclitaxel coated balloon angioplasty,Conventional balloon angioplasty|Conventional balloon angioplasty,||||inclusion_exclusion: Inclusion Criteria: 1. Patients with Peripheral vascular disease with or without diabetes. 2. Rutherford class 2-6. 3. Target lesions with a diameter reduction of at least 50% on angiography, and without past history of any intervention. 4. Target vessel with 2.0--10.0mm in diameter and having a lesion of about 4cm-20cm in length. 5. Written informed consent signed by the patients or representatives Exclusion Criteria: 1. Previous bypass surgery or stent placement at the ipsilateral lower limb 2. History of intolerance to antiplatelet therapy, heparin, or contrast media. 3. Bleeding diathesis; 4. Active systemic bacterial infection; 5. Severely impaired renal function (serum creatinine level > 2.5 mg/dL. 6. Expected survival time of less than 24 months ||mesh_term:Peripheral Arterial Disease,Peripheral Vascular Diseases,Paclitaxel,Albumin-Bound Paclitaxel,||||
NCTID:NCT01556542||dmc_oversight:No||primary_outcome_count:1||primary_outcome_list:angiographic binary restenosis|12 months|,||||secondary_outcome_count:3||secondary_outcome_list:major amputation|24 months|,target lesion revascularization|24 months|,vessel reocclusion|24 months|,||||arm_group_count:2||arm_group_list:standard PTA|nitinol stent implantation,DEB|paclitaxel-eluting balloon angioplasty followed by nitinol stent implantation,||||inclusion_exclusion: Inclusion Criteria: - age>18 years - intermittent claudication(Fontane III or IV) - angiographic stenosis>50% or occlusion of superficial femoral-popliteal artery>40mm - at least one below-knee vessel to the ankle Exclusion Criteria: - allergy to Paclitaxel - contraindication for combined antiplatelet treatment - life expectancy <1 year - hypersensitivity or contraindication to one of the study drugs - lack of consent ||mesh_term:Peripheral Arterial Disease,Peripheral Vascular Diseases,Paclitaxel,Albumin-Bound Paclitaxel,||||
NCTID:NCT02033135||dmc_oversight:No||primary_outcome_count:1||primary_outcome_list:Maximal walking distance|24 months|,||||secondary_outcome_count:3||secondary_outcome_list:Ankle brachial pressure indices|24 months|,Quality of life|24 months|,Cost of the treatment|24 months|,||||arm_group_count:2||arm_group_list:Angioplasty with Zilver PTX|Angioplasty and stenting with a polymer free paclitaxel-eluting stent (Zilver-PTX) plus unsupervised exercise therapy, smoking cessation advice and best medical therapy.,Best medical treatment|Unsupervised exercise therapy, smoking cessation advice and best medical therapy.,||||inclusion_exclusion: Inclusion Criteria: - Patient has signed and dated the informed consent. - Patient has 1- 2 documented stenotic or occluded atherosclerotic lesions (up to 18 cm long) of the above-the-knee femoropopliteal artery, that meet all of the inclusion criteria and none of the exclusion criteria. - Reference vessel (the above-the-knee femoropopliteal artery) diameter of 4 mm to 9 mm. - Taget lesion(s) should be accessible for stenting, as imaged with angiography (digital subtraction, MRI or CTI), i.e. proximal cm of SFA must be open - Patient has a de novo or restenotic lesion(s) with >50% stenosis documented angiographically and no prior stent in the target lesion. - Patient has symptoms of peripheral arterial disease classified as Rutherford Category 2 (moderate claudication) or 3 (severe claudication) lasting for at least 3 months. (Positive Claudication Questionnaire) - Exercise therapy, smoking cessation advise and best medical therapy must have been implemented at least 3 months ago and without significant clinical effect. - Patient has a resting ABI <0.9 or an abnormal exercise ABI (decrease of more than 0.15) if resting ABI is normal. Patient with incompressible arteries (ABI >1.2) must have a TBI <0.8. - Patient agrees to return for a clinical status assessment and duplex ultrasound at 6 weeks, 6 months, 12 months, and at 24 months. Exclusion Criteria: - Patient is pregnant, breast-feeding or under 18 years of age. - Patient unable to understand and sign informed consent forms - Patient is simultaneously participating in another investigational drug or device study. - Patient has any planned surgical or interventional procedure within 30 days after the study procedure. - Patient in whom antiplatelet and/or anticoagulant therapy is contraindicated. - Patient has known hypersensitivity or contraindication to aspirin, antiplatelet medication, contrast dye, paclitaxel or nitinol. - Patient 2-3 patent crural vessel runoff with <50% stenosis throughout its course. - Activity limited by co-morbid condition other than claudication, for example: severe coronary artery disease; angina pectoris; chronic lung disease; neurological disorder such as hemiparesis; arthritis, or other musculoskeletal conditions including amputation and BMI > 40 - Other active significant medical problems such as cancer, known chronic renal disease (serum creatinine greater than 2.0 mg/dl within 60 days or renal replacement therapy), known chronic liver disease or anaemia, active substance abuse, or known history of dementia ||mesh_term:Atherosclerosis,Peripheral Arterial Disease,Peripheral Vascular Diseases,Paclitaxel,Albumin-Bound Paclitaxel,||||
NCTID:NCT02812966||dmc_oversight:No||primary_outcome_count:1||primary_outcome_list:Primary patency (Peak systolic velocity ratio<=2.4)|12 months|,||||secondary_outcome_count:1||secondary_outcome_list:Target lesion revascularization rate|12 months|,||||arm_group_count:2||arm_group_list:Lutonix DCB|Lutonix 035 Drug coated Balloon PTA Catheter,IN.PACT DCB|IN.PACT Admiral Paclitaxel-Coated PTA Balloon Catheter,||||inclusion_exclusion: Inclusion Criteria: 1. Patient is willing and able to provide informed consent, willing and agrees to comply with regular follow up visits, testing, medication regimen compliance any another treatments deemed necessary for treatment of vascular disease. 2. Male or non-pregnant female 3. Age greater >=18 years of age 4. Patients with moderate to severe claudication or ischemic rest pain as defined by Rutherford 2-4 class symptoms 5. >=1 tibial run-off vessel at baseline 6. Angiographic criteria - >=70% stenosis (via visual angiographic estimate in the superficial femoral artery and/or popliteal arteries as appropriate) - 4-7mm vessel diameter - <=15cm for planned treatment segment length. - Planned treatment segments are to no further proximal than 1 cm from the bifurcation of the common femoral artery and no further distal than the 1 cm above the tibioperoneal trunk. - Lesions treated within the target vessel are either De Novo lesions or not previously stented restenotic segments of the superficial femoral artery and/or popliteal artery that are greater than 90 days from prior angioplasty procedure - If the target vessel was previously stented the treated lesion must be at least 3 cm from the previously placed stent - Lesion must be able to be treated with either drug coated balloon device based on the sizes specifications of both devices - Successful, uncomplicated crossing must be possible within the treated lesion either with or without a crossing device - Inflow artery must be free from significant occlusive disease (< 50%) as confirmed by visual estimation by angiography otherwise the inflow artery must be treated beforehand. - At least 1 patent vessel outflow from the target vessel treated must be present by angiography Exclusion Criteria: 1. Unable to meet clinical criteria to have peripheral angioplasty and follow-up treatment (lab values and pregnancy test) 2. Contra-indicated to either DCB 3. < 18 years of age at time of consent and/or index procedure 4. Pregnant or Breast feeding 5. In-stent restenosis within the target lesion 6. Previously stented target lesion/vessel. 7. Target lesion/vessel previously treated with drug-coated balloon <12 months prior to randomization/enrollment. 8. Perforated vessel as evidenced by extravasation of contrast media prior to consent or enrollment. 9. Presence of other hemodynamically significant outflow lesions in the target limb requiring intervention <=30 days of consent or randomization. 10. Presence of aneurysm in the target vessel. 11. Major amputation in the target limb. 12. Subjects who have undergone prior surgery of the SFA/PPA in the target limb to treat atherosclerotic disease. 13. Use of atherectomy, laser or other debulking devices in the target limb SFA/PPA during the index procedure. 14. Acute ischemia and/or acute thrombosis of the SFA/PPA prior to consent or randomization. 15. Known hypersensitivity or contraindication to contrast dye that, in the opinion of the local investigator, cannot be adequately pre-medicated. 16. Known hypersensitivity/allergy to the investigational stent system or protocol related therapies. 17. On dialysis or on an immunosuppressant therapy. 18. Concomitant renal failure (including serum creatinine >2.0 mg/dL.) 19. Occurrence of myocardial infarction (MI) or cerebrovascular accident (CVA) <=6 months prior to consent. 20. Platelet count <80,000 mm3 or >600,000 mm3 or history of bleeding diathesis. 21. Unstable angina pectoris at the time of consent or randomization. 22. Septicemia at the time of consent or randomization. 23. Moderate to severely calcified lesions. ||mesh_term:Peripheral Arterial Disease,Peripheral Vascular Diseases,||||
NCTID:NCT00776906||dmc_oversight:n/a||primary_outcome_count:1||primary_outcome_list:Evaluation of Late Lumen Loss|6 months|,||||secondary_outcome_count:0||secondary_outcome_list:||||arm_group_count:2||arm_group_list:1|PTX-coated balloon,2|Bare balloon,||||inclusion_exclusion: Key Inclusion Criteria: - Age >18 years. - Able to provide informed consent. - Has at least one de novo or restenotic lesion(s) with > 70% stenosis documented angiographically of the SFA or popliteal artery. If more than one lesion requires intervention, only one should be treated as a study lesion. Key Exclusion Criteria: - Has significant stenosis (> 50%) or occlusion of inflow tract (proximal ipsilateral, iliofemoral, or aortic lesions) not successfully treated before this procedure. - Lack of at least one patent runoff vessel with < 50% stenosis throughout its course. - Lesions in target area requiring atherectomy (or ablative devices), cutting balloons, cryoplasty balloons, or any other advanced device to facilitate angioplasty balloon or stent delivery. ||mesh_term:Peripheral Arterial Disease,Peripheral Vascular Diseases,||||
