NCTID:NCT02599389||dmc_oversight:Yes||primary_outcome_count:2||primary_outcome_list:Incremental cost per Qaly gained at 18 months|18 months after angioplasty|,Incremental cost per avoided stenosis relapse at 18 months|18 months after angioplasty|,||||secondary_outcome_count:9||secondary_outcome_list:New In-stent restenosis during follow-up|1 month, 6 months, 12 months and 18 months after angioplasty|,A major adverse event|1 month, 6 months, 12 months and 18 months after angioplasty|,Improvement in the walking procedure|Before and 12 months after angioplasty|,Clinical improvement|6 months, 12 months and 18 months after angioplasty|,Systolic blood pressure Index|6 months, 12 months and 18 months after angioplasty|,new treatment for the treated lesion|6 months, 12 months and 18 months after angioplasty|,revascularization, with restenosis of the treated lesion|6 months, 12 months and 18 months after angioplasty|,recurrence of clinical symptoms|6 months, 12 months and 18 months after angioplasty|,Blood ultrasonic doppler velocimetry|6 months, 12 months and 18 months after angioplasty|,||||arm_group_count:3||arm_group_list:Standard balloon|Angioplasty with use of standard balloons,Drug-coated balloons|Angioplasty with use of drug-coated balloons,Drug-coated balloons and laser|Angioplasty with use of drug-coated balloons in association with Excimer Laser,||||inclusion_exclusion: Inclusion Criteria: - Patient of age > 18 years - Patient with previously peripheral implanted stent(s) located in or extending to the popliteal artery - Patient who received this stent between 3-36 months before inclusion - Patient with one or more in-stent restenosis lesion(s) > 70% in the same arterial segment in association with clinical symptoms of claudication or an critical limb ischemia with Rutherford classification of 2, 3, 4 or 5 - Reference vessel diameter between 4 and 7 mm - Patient affiliated to a social security regimen - EC-approved consent form signed by the participant and the investigator (must be signed prior initiation of any study related intervention) Exclusion Criteria: - Life expectancy >18 months - Patient already included in this study (recruitment of the contralateral leg is not allowed) - Patient contraindicated for the use of antiplatelet therapy - Pregnant or breast-feeding women - Patient with a target limb infection being treated - Patient with a procoagulant blood disease - Patient with history of contrast agents allergies - Patient with intolerance to paclitaxel - Patient with severe renal impairment (GFR <30 ml / min / 1.73 m²) or patient with a creatinine clearance <15 ml / min - External compression of previously implanted stent - Patient participating in any clinical trial using another investigational drug or product which could interfere with the interpretation of the trial results. - Patient under trusteeship or guardianship Angiographic exclusion criteria : - Inflow (above) severe lesion >70% or occlusion untreated satisfactorily (residual lesion> 50%) before the management of the target lesion - Perforation, dissection or lesions on the arterial network access requiring an assumption prior to randomization - Stent fracture grade 4 or 5 at the target lesion ||mesh_term:||||
NCTID:NCT02710656||dmc_oversight:No||primary_outcome_count:1||primary_outcome_list:Efficacy measured by binary restenosis rate|Until 12 months after procedure|,||||secondary_outcome_count:7||secondary_outcome_list:Immediate procedural outcome of percutaneous balloon angioplasty|From start of procedure surgery until completion of procedure surgery (Percutaneous balloon angioplasty)|,Rutherford|Baseline until 12 months after procedure|,Mortality|Until 12 months after procedure|,Repeated target lesion revascularization (TLR) rate|Until 12 months after procedure|,Repeated target extremity revascularization (TER) rate|Until 12 months after procedure|,Minor and major amputation rate|Until 12 months after procedure|,Ankle-Brachial Index (ABI)|Baseline until 12 months after procedure|,||||arm_group_count:2||arm_group_list:Drug Coated Balloon (DCB) - Legflow®|Percutaneous balloon angioplasty performed with the investigational device, the paclitaxel eluting Legflow® balloon.,Standard PTA - POBA|Percutaneous balloon angioplasty performed with the clinical standard, that is, a non-drug eluting balloon (POBA, plain old balloon angioplasty).,||||inclusion_exclusion: Inclusion Criteria: 1. Patient must sign the informed consent form prior to the index-procedure. 2. Patient must be older than 18 years. 3. Patient with Rutherford 2, 3 and 4.. 4. Target lesion is an occlusion or ≥70% stenosis (visual estimate) located in SFA or popliteal artery (P1 -P2). 5. Maximum length of the target lesion is 13 cm. 6. Target lesion is TASC A, B or C. 7. Target lesion is a de novo lesion or restenotic lesion (previously POBA treated, in-stent restenosis is not allowed). 8. Inflow arteries are free from hemodynamically significant obstruction (i.e. ≥ 50% diameter stenosis). It is allowed to treat inflow lesions during the index-procedure if the result is ≤ 30% diameter stenosis (treatment with DCB or DES is not allowed). Treatment of a non-target lesion in the target vessel is allowed if the nontarget lesion is considered to be an inflow lesion. 9. Popliteal artery P3 segment (below knee popliteal artery) is free from hemodynamically significant obstruction (i.e. ≥ 50%). Treatment of a lesion in this segment is not allowed during the index-procedure. 10. At least 1 patent (< 50% diameter stenosis) below-the-knee vessel (anterior tibial artery, posterior tibial artery or peroneal artery) till the ankle as confirmed by baseline angiography. Exclusion Criteria: 1. Patient is already included in this study (recruitment of the contralateral leg is not allowed). 2. Patient has a known intolerance to antiplatelet therapy or contrast agent. 3. Patient with known sensitivity to Paclitaxel. 4. Patient is pregnant or patient intends to become pregnant within 1 year after the index-procedure. 5. Patient takes esomeprazole or omeprazole. 6. Patient with serum creatinine >2.0 mg/dL or renal dialysis. 7. Patient suffers from acute limb ischemia defined as any sudden decrease in limb perfusion causing a potential threat to limb viability. 8. Patient has a life expectancy <2 years. 9. Patient with Rutherford 0, 1 , 5 and 6. 10. Patient has a target lesion that is severely calcified (grade 3 and grade 4). 11. Patient with a TASC D lesion. 12. Patient has an acute thrombus or aneurysm in the target vessel. 13. Patient has a target lesion that cannot be crossed with a guidewire. 14. Target vessel has been treated previously with a DCB or a DES. 15. Treatment of outflow lesions during the index-procedure. 16. Patients with significant disease of all 3 infrapopliteal vessels (i.e. ≥ 50% diameter stenosis in each vessel). 17. Any scheduled surgery within 3 months after the index-procedure that would necessitate the discontinuation of clopidogrel. 18. Patients with previous bypass surgery involving the SFA. 19. Patient has cirrhosis of the liver. ||mesh_term:Atherosclerosis,Paclitaxel,Albumin-Bound Paclitaxel,||||
NCTID:NCT01221610||dmc_oversight:Yes||primary_outcome_count:1||primary_outcome_list:Assessment of the 6 months late lumen loss in the target lesion measured by quantitative vascular angiography (QVA).|6 months|,||||secondary_outcome_count:5||secondary_outcome_list:6 months binary restenosis rate|6 months|,6 months and 12 months TLR rate|6 and 12 months|,6 months and 12 months change in mean ABI|6 and 12 months|,6 months and 12 months change in Rutherford class|6 and 12 months|,Major Adverse Event rate at 6 and 12 months (procedure- or device-related death or amputation, target lesion thrombosis and clinically driven TLR)|6 and 12 months|,||||arm_group_count:2||arm_group_list:Drug Releasing Balloon|Passeo-18 Lux Drug Releasing Balloon catheter,Standard PT A (POBA)|Uncoated Passeo-18 PTA catheter,||||inclusion_exclusion: Inclusion Criteria: 1. Age ≥ 50 years, 2. Informed consent signed by patient prior to randomization 3. Single or sequential de novo or restenotic lesions (stenosis ≥ 70% diameter reduction or occlusion) in the femoropopliteal arteries ≥ 30 mm and ≤ 200 mm long 4. Rutherford Class 2 - 5 in the target limb 5. Reference Vessel Diameter (RVD) 3 - 7 mm, based on visual estimation 6. Inflow free from flow-limiting lesion (< 50% stenosis) confirmed by angiography. Patients with flow-limiting inflow lesions (> 50% stenosis) can be included if lesion has been treated successfully before the index procedure 7. At least one non-occluded crural vessel (eg without significant stenosis) with angiographically documented run-off to the foot 8. Successful wire crossing of the lesion 9. Willingness to comply with all specified follow-up evaluations 10. Male or negative pregnancy test of women in childbearing age Exclusion Criteria: 1. Co-morbid conditions limiting life expectancy ≤ 1 year 2. Patient currently participating in another clinical trial 3. Lesions which are untreatable with PTA or other interventional techniques 4. The target stenosis is located distal to a stenosis ≥ 50% that cannot be pre-treated because the drug coating could get lost during crossing the proximal lesion 5. Thrombus in the target vessel, documented by angiography 6. Target lesion is severely calcified, documented by angiography 7. Prior bypass surgery of target vessel 8. Previously implanted stent in the target lesion 9. Treatment of bifurcation required 10. Planned amputation of the target limb 11. Flow-limiting (> 50% DS) Inflow lesion proximal to target lesion, left untreated 12. Failure to obtain <30% residual stenosis in a pre-existing haemodynamically significant (>50% DS) inflow lesion in the ipsilateral iliac or proximal SFA. (DEB or DES not allowed for the treatment of inflow lesion) 13. Additional hemodynamically relevant proximal and distal lesions with stenosis ≥ 50 %, except iliac arteries, are excluded. Iliac artery lesion treatments have to be successful with a residual stenosis ≤ 30 % 14. Haemorrhagic diathesis or another disorder such as gastrointestinal ulceration or cerebral circulatory disorders which restrict the use of platelet aggregation inhibitor therapy and anticoagulation therapy 15. Phenprocoumon intake 16. Impaired renal function (creatinine ≥ 2.0 - 2.5 mg/dl), according to investigator assessment 17. Known allergy to contrast media that cannot be adequately controlled with pre-medication 18. Allergy, intolerance or hypersensitivity to Paclitaxel structurally or related compounds and/or to the delivery matrix n-Butyryl tri-nhexyl citrate (BTHC) ||mesh_term:Atherosclerosis,Vascular Diseases,Peripheral Arterial Disease,Arteriosclerosis,||||
NCTID:NCT01867736||dmc_oversight:Yes||primary_outcome_count:2||primary_outcome_list:Safety: Major adverse event rate (MAE), defined as all cause death, major amputation of target extremity, target lesion thrombosis, target lesion revascularisation (TLR)and target vessel revascularization (TVR) at 30 days.|30 days|,Performance: Target lesion primary patency rate at 6 months assessed by quantitative vascular angiogram (QVA).|6 months|,||||secondary_outcome_count:12||secondary_outcome_list:Target lesion failure, assessed by target lesion revascularization (TLR) rate at 6 months and 12 months|6 and 12 months|,Target vessel revascularization (TVR) rate at 6 months and 12 months|6 and 12 months|,Binary re-stenosis rate at 6 months, assessed by QVA|6 months|,Major adverse event rate, defined as all cause death, major amputation of target extremity, target lesion thrombosis, TLR and TVR at 6 months and 12 months|6 and 12 months|,Change in mean ABI at discharge, 30 days, 6 months and 12 months|Discharge, 30 days, 6 months and 12 months|,Change in Rutherford classification at 30 days, 6 months and 12 months|30 days, 6 months and 12 months|,Quality of life evaluation, assessed by EQ5D questionnaire at baseline, 30 days, 6 months and 12 months|Baseline, 30 days, 6 months and 12 months|,Duplex based primary patency at 30 days, 6 months and 12 months|30 days, 6 months and 12 months|,Procedural success, defined as successful vascular access, completion of endovascular procedure and immediate morphologic success with a residual stenosis <30%.|Day 0|,Device success, defined as exact deployment according to Instructions For Use|Day 0|,Technical success, defined as device or procedural success without the occurrence of major adverse events during the hospital stay.|Participants will be followed for the duration of hospital stay, an expected average of 1-2 days|,Late Lumen Loss|6-months post-procedure|,||||arm_group_count:2||arm_group_list:Passeo-18 Lux DRB|Passeo-18 Lux Drug Releasing Balloon catheter,Standard PTA (POBA)|Uncoated Passeo-18 PTA balloon catheter,||||inclusion_exclusion: Inclusion Criteria: 1. Subject has provided written informed consent. 2. Subject is willing and able to comply with follow-up evaluations. 3. Subject is ≥ 18 years old. 4. Single or sequential de novo or restenotic lesions (stenosis ≥ 70% diameter reduction or occlusion) in the infrapopliteal arteries ≥ 30 mm. Lesions should not extend beyond the ankle joint. 5. A maximum of 2 different vessels can be treated: successful wire crossing is required for the first target vessel before randomization occurs. 6. Subject with PAD or critical limb ischemia according to the current guidelines in need for urgent revascularization to relieve symptoms and improve walking capacity. 7. Reference Vessel Diameter (RVD) 2 - 4 mm, based on visual estimation. 8. Inflow free from flow-limiting lesion confirmed by angiography. Patients with flow-limiting inflow lesions (> 50% stenosis) can be included if lesion(s) have been treated successfully before the index procedure, with a maximum residual stenosis of 30% per visual assessment. 9. At least one non-occluded crural vessel with angiographically documented run-off to the foot. 10. Successful wire crossing of the lesion. Exclusion Criteria: 1. Flow-limiting (> 50% DS) inflow lesion proximal to target lesion, left untreated. 2. Failure to obtain <30% residual stenosis in a pre-existing haemodynamically significant (>50% DS) inflow lesion (DEB or DES not allowed for the treatment of inflow lesions). 3. Infrapopliteal lesions extending beyond the ankle joint and involving crural vessels. 4. Acute thrombus in the target vessel (eg complication of inflow lesion treatment) documented by angiogram, if not treated successfully prior to enrolment). 5. Planned major amputation above the ankle of target limb, or any other planned major surgery within 30 days post-procedure. 6. Previous bypass surgery of target vessel. 7. Previously implanted stent in target lesion. 8. Haemorrhagic diathesis or coagulopathy or other disorders such as gastrointestinal ulcerations or cerebral disorders that would restrict prescription of dual anti-platelet therapy. 9. Subject with hepatic failure, deep vein thrombosis, thrombophlebitis, systemic lupus erythematous or subject is on immunosuppressant therapy. 10. Subject with acute MI ≤ 3 months. 11. Renal failure with a creatinine of ≥ 2,5 mg/dl, except patients currently on regular dialysis. 12. Phenprocoumon intake, except for patients who are treated for Arterial Fibrillation. For these patients Phenprocoumon treatment can be interrupted and re-started after treatment with Dual Antiplatelet Therapy for 4 weeks post procedure. 13. Known allergy to contrast media used for angiography that cannot be controlled by pre-medication with steroids and/or antihistaminica. 14. Allergy, intolerance or hypersensitivity to Paclitaxel or related compounds and/or to the delivery matrix n-Butyryl tri-n-hexyl citrate(BTHC). 15. Co- morbid conditions limiting life expectancy ≤ 1 year. 16. Patients that are under active treatment for cancer; Patients, who have been successfully treated for cancer in the past, can be included. 17. Subject is participating in another clinical device trial where the primary endpoint has not yet been reached. 18. Pregnant and/or breast-feeding females or females who intend to become pregnant during the time of the study. ||mesh_term:Atherosclerosis,Vascular Diseases,Peripheral Arterial Disease,Arteriosclerosis,||||
NCTID:NCT00696956||dmc_oversight:No||primary_outcome_count:1||primary_outcome_list:Primary endpoint: Late lumen loss (LLL) of the target lesion after 6 months (assessed by DSA)|after 6 months|,||||secondary_outcome_count:16||secondary_outcome_list:Interventional success rate (defined as reststenosis less than 50%)|up to 18 months|,Restenosis rate at 6 and 18 months (restenosis rate is defined as a diameter stenosis of ≥ 50% of reference diameter|up to 18 months|,Minimum lumen diameter (MLD) at 6 months|up to 18 months|,Target lesion revascularization recorded at 6, 12 and 18 months; target lesion revascularization is defined as any reintervention or artery bypass graft surgery involving the target lesion.|up to 18 months|,Target vessel revascularization recorded at 6, 12 and 18 months|up to 18 months|,Target limb revascularization recorded at 6, 12 and 18 months|up to 18 months|,Improvement of clinical stage at 6, 12 and 18 months|up to 18 months|,Change in ABI compared to pretreatment if vessels are compressible|up to 18 months|,Hospitalization (extra days due to complications of the index procedure) and hospitalization between the follow-up visits due to the index leg|up to 18 months|,Major amputations at the index limb|up to 18 months|,Mortality|up to 18 months|,LLL of stented segments at 6 months comparing the uncoated and the coated bal-loon group.|up to 18 months|,Subgroup analysis; primary endpoint and TLR|up to 18 months|,LLL, MLD and restenosis rate at 18 month follow-up determined by angiography|up to 18 months|,Subgroup analysis neuropathy and no neuropathy according to clinical improve-ment in patients classified Rutherford 5|up to 18 months|,Clinical benefit patients Rutherford 3 vs. Rutherford 4 and 5|up to 18 months|,||||arm_group_count:2||arm_group_list:A|Normal balloon for balloon angioplasty (Submarine, Ampherion Deep by Invatec),2|Paclitaxel coated balloon (same balloon like in the control group, but coated with 3 µg/mm2 Paclitaxel),||||inclusion_exclusion: Inclusion Criteria: - Age between 18 and 95 years, - peripheral vascular disease, Rutherford stage 3-5, diameter stenosis ≥ 70 %, ≥ 15 -150 mm length, up to 2 vessels to be treated Exclusion Criteria: - Disease associated with life-expectancy less than 18 months - Acute thrombus or aneurysm in the index limb/ vessel - Doubts in the willingness or capability of the patient to allow follow up examination ||mesh_term:Atherosclerosis,Paclitaxel,Albumin-Bound Paclitaxel,||||
NCTID:NCT00930813||dmc_oversight:Yes||primary_outcome_count:1||primary_outcome_list:Angiographic Late Lumen Loss|6 months|,||||secondary_outcome_count:10||secondary_outcome_list:Safety - Device Related Adverse Events|30 days|,Primary Patency of Treated Segment|6, 12, 24 months|,Target Lesion Revascularization|6, 12, 24 months|,Target Vessel Revascularization|6, 12, 24 months|,Device Success|at procedure|,Procedural Success|at procedure|,Change in Ankle-brachial Index|pre-procedure, 6, 12 and 24 months|,Change in Walking Impairment Questionnaire (WIQ)|pre-procedure, 6, 12 and 24 months|,Change in Rutherford Grade|pre-procedure,6, 12 and 24 months|,Serum Paclitaxel Levels - in Subsets of Patients|0, 1, 3 hours and pre-discharge|,||||arm_group_count:2||arm_group_list:Lutonix Catheter|Paclitaxel coated Balloon Catheter,Standard uncoated Balloon Angioplasty Catheter|uncoated angioplasty balloon,||||inclusion_exclusion: Inclusion Criteria: Clinical Criteria - Male or non-pregnant female ≥18 years of age. - Rutherford Clinical Category 2-5 - Patient is willing to provide informed consent and comply with the required follow up visits, testing schedule, and medication regimen Angiographic Criteria - A single de novo or restenotic atherosclerotic lesion >70% in the SFA or popliteal artery that is ≥4 cm and ≤15 cm in total length. - Reference vessel diameter ≥4 mm and ≤ 6mm - Successful wire crossing of lesion - A patent inflow artery free from significant lesion (>50% stenosis) as confirmed by angiography (treatment of target lesion acceptable after successful treatment of inflow artery lesions) Exclusion Criteria: - Pregnant or planning on becoming pregnant in < 2yrs - Live expectancy of <2 years - Patient actively participating in another investigational device or drug study - History of hemorrhagic stroke within 3 months - Previous or planned surgical or interventional procedure within 30 days of index procedure - Chronic renal insufficiency with creatinine >2.5 mg/L - Prior surgery of the target lesion - Inability to take required study medications - Anticipated use of IIb/IIIa inhibitor prior to randomization - Lesion length is <4 cm or >15 cm or there is no normal proximal arterial segment in which duplex ultrasound velocity ratios can be measured - Known inadequate distal outflow - Significant inflow disease - Acute or sub-acute thrombus in target vessel - Severe lesion calcification - Acute vessel occlusion or sudden symptom onset - Use of adjunctive therapies (i.e. laser, atherectomy, cryoplasty, scoring/cutting balloon, etc.) - Prior participation in the current study ||mesh_term:Atherosclerosis,Vascular Diseases,Arteriosclerosis,Paclitaxel,Albumin-Bound Paclitaxel,||||
