NCTID:NCT01728441||dmc_oversight:Yes||primary_outcome_count:2||primary_outcome_list:Peak Systolic Velocity Ratio (PSVR)|12 months|,target lesion revascularization (TLR)|12 months|,||||secondary_outcome_count:9||secondary_outcome_list:Major Adverse Events (MAEs)|6, 12 and 24 months|,All cause death|6, 12 and 24 months|,Target vessel revascularization (TVR)|6, 12 and 24 months|,Clinically-driven target lesion revascularization (TLR)|6, 12 and 24 months|,Major target limb amputation within 6, 12 and 24 months. Major target limb Major target limb amputation|6, 12 and 24 months|,Sustained clinical improvement|6, 12 and 24 months|,Binary restenosis|6, 12 and 24 months|,Walking capacity|6, 12 and 24 months|,Procedural success|6, 12 and 24 months|,||||arm_group_count:2||arm_group_list:Paclitaxel Eluting Stent|Patients randomized to treatment with paclitaxel eluting stent will receive the Zilver® PTX® stent.Primary stenting should be performed covering the full lesion. Post-dilatation is at the investigator's discretion.,Paclitaxel Eluting Balloon|For patients randomized to treatment with drug eluting balloon (DEB), angioplasty (ballooning) should be performed covering the full lesion.,||||inclusion_exclusion: Inclusion Criteria: - Subject age ≥ 18 - Subject has been informed of the nature of the study, agrees to participate, and has signed a Medical Ethics Committee approved consent form. - Subject understands the duration of the study, agrees to attend follow-up visits, and agrees to complete the required testing. - Rutherford category 2-5. - Subject has a de novo or restenotic lesion with ≥ 70% stenosis documented angiographically and no prior stent in the target lesion. - Target lesion is at least 1cm below the origin of the profunda femoris and does not exceed the medial femoral epicondyle. - A single target lesion (stenotic areas separated by more than 3 cm with ≤ 30% stenosis might, at the decision of the investigator, be considered as 2 lesions). - Reference vessel diameter (RVD) ≥ 4 mm and ≤ 6.5 mm by visual assessment. - Patency of at least one (1) infrapopliteal artery to the ankle (< 50% diameter stenosis) in continuity with the native femoropopliteal artery. - A guidewire has successfully traversed the target treatment segment. Exclusion Criteria: Clinical exclusion criteria - Inability to obtain informed consent. - Life expectancy < 12 months. - Pregnancy, suspected pregnancy, or breastfeeding during study period (patients of childbearing potential must have negative serum pregnancy test 7 days prior to treatment). - Presence of one or more of the following co-morbid factors: hemodialysis dependence, renal insufficiency with a serum creatinine ≥ 2.5 mg/dl, cerebrovascular accident (CVA) within 1 month of procedure or any CVA resulting in unresolved walking impairment, and/or myocardial infarction (MI) within 1 month of procedure. - Any evidence of hemodynamic instability prior to procedure/randomization. - Coagulopathy or clotting disorders. - Present or suspected systemic infection or osteomyelitis affecting target limb. - Contraindication to contrast media or any study-required medication (antiplatelets, anticoagulants, thrombolytics, etc). - Hypersensitivity to nitinol and/or paclitaxel. - Enrollment into another study. - Intervention of the target lesion less than 90 days prior of the study procedure. Anatomic Exclusion Criteria: - Untreated external iliac artery inflow lesion (study allows for successful treatment prior to study treatment procedures). - Total occlusion uncrossable by a conventional guidewire. - Acute occlusive intraluminal thrombosis of the proposed lesion site. - Evidence of an aneurysm at the target lesion site. - Perforation in the target vessel as evidenced by the extravasation of contrast. ||mesh_term:Peripheral Arterial Disease,Paclitaxel,Albumin-Bound Paclitaxel,||||
NCTID:NCT01960647||dmc_oversight:No||primary_outcome_count:1||primary_outcome_list:Rate of clinically driven target lesion revascularization|6 months|,||||secondary_outcome_count:10||secondary_outcome_list:Technical success|Baseline|,Clinical success|Baseline|,Procedural success|Baseline|,Ankle Brachial index improvement|6, 12, 24 months|,Change in Rutherford classification|6, 12, 24 months|,Walking improvement|6, 12 ,24 months|,Rate of minor and major complications|6,12, 24 months|,Rate of target lesion revascularization|12, 24 months|,Late lumen loss|6 months|,Patency rate|6, 12, 24 months|,||||arm_group_count:2||arm_group_list:Uncoated PTA balloon catheter|Dilatation with uncoated PTA balloon catheter,Freeway Paclitaxel balloon catheter|Dilatation with Freeway Paclitaxel (3 µg/mm2) coated balloon catheter,||||inclusion_exclusion: Inclusion Criteria: - Male or non-pregnant female (> 18 years of age) with symptomatic ischemia, requiring treatment of SFA or PI segment ( 2-5 of Rutherford classification) - Single and/or multiple de novo occluded, stenotic or reoccluded, restenotic lesion(s) of > 70% , ≤ 15 cm in total length and vessel diameter ≥ 4mm and ≤ 7mm (by visual estimation). - Patient provides a signed informed consent and complies with the follow up visits - Successful wire crossing of lesion - At least one patent (less than 50% stenosis) tibioperoneal run-off vessel Exclusion Criteria: - Gastrointestinal bleeding or coagulopathy contraindicating use of anti-platelet therapy - Known intolerance contraindications to study medications and contrast agents, non-controllable with medication. - Patient actively participating in another device or drug study - History of hemorrhagic stroke within 3 months - Previous or planned surgical or intervention procedure within 30 days of index procedure - Significant untreated inflow disease or no normal arterial segment proximal of lesion in which duplex ultrasound velocity ratios can be measured - Acute or sub-acute thrombus in target vessel - Use of adjunctive therapies (i.e. laser, atherectomy, cryoplasty, scoring/cutting balloon) - Patients with in-stent restenosis or prior surgery of the target lesion - Patients with abdominal aortic, iliaca or popliteal aneurysm (AAA) with ≥ 4cm diameter ||mesh_term:Peripheral Arterial Disease,Paclitaxel,Albumin-Bound Paclitaxel,||||
NCTID:NCT01969630||dmc_oversight:No||primary_outcome_count:1||primary_outcome_list:angiographic binary restenosis|12 months|,||||secondary_outcome_count:1||secondary_outcome_list:Composite of all cause mortality, major amputation and target lesion revascularization.|12 months|,||||arm_group_count:2||arm_group_list:PEB|PEB angioplasty plus provisional nitinol stent implantation,PES|Systematic PES angioplasty,||||inclusion_exclusion: Inclusion Criteria: - intermittent claudication or critical limb ischemia - de novo stenosis ≥ 50% or occlusion of at least 40 mm in length located in femoropopliteal arteries - presence of a clear healthy segment between the lesion in superficial femoral and common femoral artery and between popliteal and tibioperoneal trunk - presence of at least 1 patent tibial vessel with distal run-off (below-the-knee artery was considered patent if free from obstructive lesions determining angiographic stenosis >70%) Exclusion Criteria: - life expectancy <1 year - contraindication for combined antiplatelet therapy or known allergy to nickel or paclitaxel - need for major amputation (MA) at the time of enrolment - Failure to recanalize intended below-the-knee arteries in CLI patients at risk of major amputation ||mesh_term:Peripheral Arterial Disease,Paclitaxel,Albumin-Bound Paclitaxel,||||
NCTID:NCT02279784||dmc_oversight:No||primary_outcome_count:1||primary_outcome_list:number of events of angiographic binary restenosis|12 months|,||||secondary_outcome_count:3||secondary_outcome_list:number of events of target lesion revascularization|12 months|,number of events of death|12 months|,frequency of major amputation|12 months|,||||arm_group_count:2||arm_group_list:Freeway|angioplasty with Freeway drug-eluting balloon,Lutonix|angioplasty with Lutonix drug-eluting balloon,||||inclusion_exclusion: Inclusion Criteria: - age>18 years - angiographic stenosis>50% or occlusion of one below-knee vessel Exclusion Criteria: - allergy to Paclitaxel - contraindication for combined antiplatelet treatment - life expectancy <1 year - hypersensitivity or contraindication to one of the study drugs - lack of consent - need for amputation ||mesh_term:Peripheral Arterial Disease,||||
NCTID:NCT02517827||dmc_oversight:Yes||primary_outcome_count:1||primary_outcome_list:Primary patency|12 month|,||||secondary_outcome_count:2||secondary_outcome_list:Primary patency|24 month|,target lesion revascularisation|6, 12, and 24 month|,||||arm_group_count:2||arm_group_list:Endovascular procedure|Common femoral artery (target lesion) to be treated with directional atherectomy and paclitaxel-coated balloon angioplasty. Optional: stentimplantation.,Surgery|Common femoral artery (target lesion) to be treated with open, surgical endarterectomy,||||inclusion_exclusion: Inclusion Criteria: 1. Subject must be between 21 and 85 years old; 2. Female of childbearing potential must have a negative pregnancy test within 10 days prior to index procedure and utilize reliable birth control until completion of the 12-month angiographic evaluation; 3. Clinical diagnosis of symptomatic peripheral artery disease defined by Rutherford 2, 3, or 4; 4. Common femoral artery (CFA) stenosis (including CFA bifurcation) >70% (visual estimate) or occlusion; Additional non-target lesion(s) in remaining non-target vessel(s), except ipsilateral iliac arteries, can be treated at the physician´s discretion; 5. At least one vessel outflow (infrapopliteal arteries) to the foot (without stenosis >50%). 6. Endovascular Procedure: successful target lesion crossing of the guidewire (guidewire located intraluminally); 7. Non-target lesion interventions (TASC A and B) to restore adequate blood flow, in the same index procedure are allowed. This intervention must be prior to the treatment of the study lesion and successful; 8. Willing to comply with the specified follow-up evaluation; 9. Written informed consent prior to any study procedures. Exclusion Criteria: 1. Ipsilateral significant (>50%) stenosis of the iliac arteries. 2. Significant (>50%) stenosis of all infrapopliteal arteries, no patent artery to the foot. 3. Angiographic evidence of thrombus within target vessel; 4. Thrombolysis within 72 hours prior to the index procedure; 5. In-Stent restenosis or restenosis of the native common femoral artery. 6. Aneurysm in the abdominal aorta or iliac arteries; 7. Concomitant hepatic insufficiency, thrombophlebitis, deep venous thrombus, coagulation disorder or receiving immunosuppressant therapy; 8. Recent MI or stroke < 30 days prior to the index procedure; 9. Life expectancy less than 24 months; 10. Known or suspected active infection at the time of the index procedure; 11. Known or suspected allergies or contraindications to aspirin, clopidogrel bisulfate (Plavix) and ticlopidine (Ticlid), heparin, or contrast agent; 12. Any significant medical condition which, in the investigator´s opinion, may interfere with the subject´s optimal participation in the study; 13. The subject is currently participating in another investigational drug or device study that has not completed the primary endpoint or that clinically interferes with the endpoints of this study. ||mesh_term:Peripheral Arterial Disease,Paclitaxel,Albumin-Bound Paclitaxel,||||
NCTID:NCT03064126||dmc_oversight:Yes||primary_outcome_count:2||primary_outcome_list:Primary Lesion Patency|12 months|,Major Adverse Events (MAEs)|12 months|,||||secondary_outcome_count:15||secondary_outcome_list:Technical Success of angioplasty procedure|Day 0|,Procedural Success of angioplasty procedure|Day 0|,Clinical Success rate assessment|Day 0|,Major Adverse Events (MAE) assessment|1 month, 6 months, 12 months, 24 months, 36 months, 48 month and 60 months|,Assessment of Death occurrence from any cause|1 month, 6 months, 12 months, 24 months, 36 months, 48 months and 60 months|,Clinically-driven Target Vessel Revascularization (TVR) rates|6 months, 12 months, 24 months, 36 months, 48 months and 60 months|,Clinically-driven Target Lesion revascularization (TLR) rates|6 months, 12 months, 24 months, 36 months, 48 months and 60 months|,Rate of Primary Sustained Clinical Improvement as assessed by changes in Rutherford Classification|1 month, 6 months, 12 months, 24 months and 36 months|,Rate of Secondary Sustained Clinical Improvement as assessed by changes in Rutherford Classification|1 month, 6 months, 12 months, 24 months and 36 months|,Rate of Hemodynamic Improvement as assessed by changes in Ankle Brachial Index (ABI)|1 month, 6 months, 12 months, 24 months, and 36 months|,Target Lesion Restenosis rate|1 month, 6 months, 12 months, 24 months, and 36 months|,Walking Improvement assessed by change in Six Minute Walk Test (6MWT)|Screening, 6 months and 12 months|,Walking Improvement assessed by change in Walking Impairment Questionnaire (WIQ)|1 month, 6 months, 12 months, 24 months and 36 months|,Patient Utility Values by change in EQ-5D|1 month, 6 months, 12 months, 24 months and 36 months|,Changes in healthcare utilization over time rates|Index Procedure (Day 0), 1 month, 6 months, 12 months, 24 months, 36 months, 48 months and 60 months|,||||arm_group_count:2||arm_group_list:RANGER™ Paclitaxel Coated Balloon|RANGER™ Paclitaxel Coated Balloon Catheter angioplasty in the SFA/PPA at the index procedure.Subjects will be randomized 3:1 to the drug coated or standard angioplasty balloon.,Standard Balloon Angioplasty|Standard Balloon Catheter angioplasty in the SFA/PPA at the index procedure. Subjects will be randomized 3:1 to the drug coated or standard angioplasty balloon.,||||inclusion_exclusion: Inclusion Criteria: 1. Subject (or Legal Guardian) is willing and able to provide consent before any study-specific tests or procedures are performed and agree to attend all required follow-up visits; 2. Subject at least 20 years of age; 3. Chronic symptomatic lower limb ischemia defined as Rutherford classification 2, 3, or 4; 4. Target lesion is in the native SFA and/or PPA down to the P1 segment; 5. Patent popliteal and infrapopliteal arteries, i.e., single vessel runoff or better with at least one of three vessels patent (less than 50 % stenosis) to the ankle or foot; 6. Reference vessel diameter ≥ 4 mm and ≤ 8 mm by visual estimate; 7. Angiographic evidence that target lesion consists of a single de novo, non-stented and non-atherectomy treated or restenotic lesion (or tandem lesions or a combination lesion as defined below) that is: - ≥ 70%-99% stenotic with total lesion length up to 180 mm by visual estimate. - Occluded with total lesion length ≤ 100 mm by visual estimate. - If lesion is restenotic, most recent PTA treatment must be > 3 months prior to enrollment. Exclusion Criteria: 1. Life expectancy, documented in the Investigator's opinion, of less than 12 months; 2. Hemorrhagic stroke or cardiac event (e.g. STEMI, unstable angina) within 6 months prior to enrollment; 3. Known allergies or sensitivities to heparin, aspirin, other anticoagulant/antiplatelet therapies, and/or paclitaxel; 4. Known hypersensitivity or contraindication to contrast dye that, in the opinion of the investigator, cannot be adequately pre-medicated; 5. Chronic renal insufficiency with serum creatinine > 2.0 mg/dL within 30 days of index procedure or treatment with dialysis; 6. Platelet count < 80,000 mm 3 or > 600,000 mm 3 or history of bleeding diathesis; 7. Receiving immunosuppressive therapy; 8. Septicemia at the time of enrollment; 9. Any major intervention planned within 30 days post index procedure; 10. Presence of other hemodynamically significant outflow lesions in the target limb requiring intervention within 30 days of enrollment; 11. Failure to successfully cross the target lesion with a guidewire; 12. Failure to successfully pre-dilate the target vessel; 13. Patient has lesion that requires the use of adjunctive primary treatment modalities (i.e. laser, atherectomy, scoring/cutting balloon, other debulking devices, etc.) during the index procedure; 14. History of major amputation in the target limb; 15. Target lesion or vessel has ever been previously treated with stent (e.g. in-stent restenosis) or surgery. Target lesion or vessel has been treated with atherectomy or a DCB in the past 12 months; 16. Pregnant or breast feeding; 17. Presence of aneurysm in the target vessel; 18. Acute ischemia and/or acute thrombosis of the SFA/PPA prior to enrollment; 19. Patient has significant inflow disease which cannot be treated prior to the target lesion treatment; 20. Patient has perforated targeted vessel as evidenced by extravasation of contrast media; 21. Patient has severe calcification that renders the lesion undilatable; 22. Current participation in another investigational drug or device clinical trial that has not completed the primary endpoint at the time of randomization/enrollment or that clinically interferes with the current trial endpoints. ||mesh_term:Atherosclerosis,Peripheral Arterial Disease,Arterial Occlusive Diseases,Plaque, Atherosclerotic,Paclitaxel,Albumin-Bound Paclitaxel,||||
NCTID:NCT02013193||dmc_oversight:Yes||primary_outcome_count:1||primary_outcome_list:in-segment late lumen loss|six months|,||||secondary_outcome_count:20||secondary_outcome_list:technical success|during index procedure, less 1 hour|,procedural success|within 24 hours of index procedure|,primary patency|six months|,primary patency|twelve months|,assisted primary patency|six months|,assisted primary patency|twelve months|,secondary patency|six months|,secondary patency|twelve months|,binary restenosis rate|six months|,binary restenosis rate|twelve months|,clinical success|pre-discharge, estim. 1-2 days post-index procedure|,clinical success|six months|,clinical success|twelve months|,hemodynamic success|pre-discharge, estim. 1-2 days post-index procedure|,hemodynamic success|six months|,hemodynamic success|twelve months|,change in quality of life|six months|,change in quality of life|twelve months|,change in quality of life|24 months|,change in quality of life|36 months|,||||arm_group_count:2||arm_group_list:Ranger(TM) Paclitaxel-coated balloon|Index lesion treated with Ranger(TM) Paclitaxel-coated PTA balloon catheter (Ranger DCB),uncoated PTA balloon|Index lesion treated with an uncoated standard PTA dilatation balloon catheter selected upon investigator´s discretion,||||inclusion_exclusion: Inclusion Criteria: - Subjects must be age 18 or older - Subject is willing and able to provide informed consent - Subject is available to attend all required follow-up visits - Subject has a clinically significant symptomatic leg ischemia requiring treatment - Subject has a Rutherford clinical category of 2-4 - If the index lesion is restenotic, the prior PTA must have been >30 days prior to treatment in the current study - Only one lesion per limb can be treated under this protocol. - Successful intraluminal wire crossing of the target lesion - Index lesion is a clinically and hemodynamically significant stenotic or restenotic lesion located in the native nonstented superficial femoral artery or proximal popliteal artery - Degree of stenosis 70% or more, by visual assessment - Lesion length between 20 mm and 150 mm - At least one patent infrapopliteal artery to the foot of the index limb Exclusion Criteria: - Subjects who have undergone prior vascular surgery of the femoropopliteal artery in the index limb to treat atherosclerotic disease - History of major amputation in the same limb as the target lesion - Presence of aneurysm in the target vessel - Acute ischemia and/or acute thrombosis in any artery of the lower limbs - Acute Myocardial Infarction within 30 days before the index procedure - Persistent, intraluminal thrombus of the proposed target lesion post-thrombolytic therapy - Known hypersensitivity or contraindication to contrast dye that cannot be adequately pre-medicated - Known allergies against Paclitaxel or other components of the used medical devices - Intolerance to antiplatelet, anticoagulant, or thrombolytic medications that would be administered during the trial - Platelet count <100,000 mm3 or >600,000 mm3 - Concomitant renal failure with a serum creatinine >2.0 mg/dL - Receiving dialysis or immunosuppressant therapy - Life expectancy of less than one year - Women of child-bearing potential must agree to use a reliable method of contraception from the time of screening through 12 months after the index procedure. - Woman who is pregnant or nursing. - Previously planned stenting of the index lesion - Use of adjunctive therapies (debulking, laser, cryoplasty, re-entry devices) - Planned or expected procedures (cardiac, aorta, peripheral) within 30 days after the index procedure - Presence of outflow lesions requiring intervention within 30 days of the index procedure - Perforated vessel as evidenced by extravasation of contrast media - Heavily calcified target lesions resistant to PTA - Current participation in another drug or device trial that has not completed the primary endpoint, that may potentially confound the results of this trial, or that would limit the subject's compliance with the follow-up requirements - Current participation in any study using drug-coated/drug-eluting technologies - Current participation in any study using drug-coated/drug-eluting technologies - Target lesion with in-stent restenosis (any stent or stent-graft) ||mesh_term:Atherosclerosis,Peripheral Arterial Disease,Intermittent Claudication,Arteriosclerosis,Paclitaxel,Albumin-Bound Paclitaxel,||||
NCTID:NCT02145065||dmc_oversight:Yes||primary_outcome_count:1||primary_outcome_list:Angiographic late lumen loss|6 months|,||||secondary_outcome_count:7||secondary_outcome_list:Safety - Device related adverse events|30 days, 6 months|,Critical limb ischemia|30 days, 6 months|,Device Success|at procedure|,Target Lesion Revascularization|6, 12, 24 months|,Target vessel revascularization|6, 12, 24 months|,Primary patency of treated segment|6, 12, 24 months|,Treated limb amputation|30 days, 6 months|,||||arm_group_count:2||arm_group_list:Plain Balloon Angioplasty|Plain Balloon Angioplasty,microcrystalline Paclitaxel Coated Balloon (PAK)|plain balloon angioplasty followed by mcPCB dilation,||||inclusion_exclusion: Inclusion Criteria: - Age > 18 y.o. - Claudication in Rutherford Class 1-5, - Lesion in the femoropopliteal artery defined as >50% and < 99% diameter stenosis with length of up to 10 cm in vessel diameter of 3-7 mm - Chronic total occlusions of length less than 100 mm - Ability to cross the lesions with a guidewire. Exclusion Criteria: - Critical acute or chronic limb ischemia - Acute coronary syndrome - Chronic kidney disease stage III-V - Restenotic lesion - Femoropopliteal graft - Known allergy to clopidogrel or aspirin - History of stroke within past 6 months - Age > 80 y.o. - Life expectancy < 2 years ||mesh_term:Peripheral Arterial Disease,Paclitaxel,Albumin-Bound Paclitaxel,||||
